name,short_description,genres,minimum_system_requirement,recommend_system_requirement,release_date,developer,publisher,overall_player_rating,number_of_reviews_from_purchased_people,number_of_english_reviews,game_name,genre,rank_type,rank
Transport Fever 2,"The classic transport simulation genre has a new gold standard with Transport Fever 2. Discover a whole new world by navigating transport routes through land, water and air. May progress and prosperity find their way!","['Simulation', 'Strategy', 'Management', 'Transportation', 'City Builder', 'Trains', 'Economy', 'Sandbox', 'Building', 'Singleplayer', 'Realistic', 'Moddable', 'Open World', 'Resource Management', 'Flight', 'Casual', 'Indie', 'Games Workshop', 'Naval', 'Mod']","['Requires a 64-bit processor and operating system', 'OS *: Windows 7, 8 or 10 (64-bit)', 'Processor: Intel i5-2300 or AMD FX-6300', 'Memory: 8 GB RAM', 'Graphics: NVIDIA GeForce GTX 560 or AMD Radeon HD 7850, 2 GB VRAM']","['Requires a 64-bit processor and operating system', 'OS *: Windows 7, 8 or 10 (64-bit)', 'Processor: Intel i7-4770k or AMD Ryzen 5 1600', 'Memory: 16 GB RAM', 'Graphics: NVIDIA GeForce GTX 1060 or AMD Radeon RX 580, 4 GB VRAM']",11-Dec-19,['Urban Games'],['Good Shepherd Entertainment'],Very Positive,-20152,9456,Terraria,Adventure,Review,1
"Warhammer 40,000: Rogue Trader","Made in a close partnership with Games Workshop, Warhammer 40,000: Rogue Trader is a story-rich classical RPG from Owlcat Games, developers of the critically acclaimed game, Pathfinder: Wrath of the Righteous.","['Cinematic', 'Online Co-Op', 'Multiplayer', 'Turn-Based Strategy', 'Strategy RPG', 'Collectathon', 'Dungeon Crawler', 'Space', 'Atmospheric', 'Multiple Endings', 'Tactical RPG', 'Mystery', 'Sci-fi', 'Tactical', 'Dark Humor', 'RPG', 'Character Customization', 'Choices Matter', 'Combat', 'Exploration']","['OS: Win10', 'Processor: Intel(R) Core(TM) i5-4590T CPU @ 2.00GHz', 'Memory: 8 GB RAM', 'Graphics: AMD Radeon RX Vega 6 / Intel HD Graphics 630', 'DirectX: Version 11', 'Storage: 40 GB available space']","['OS: Win10', 'Processor: Intel(R) Core(TM) i5-6400 CPU @ 2.70GHz', 'Memory: 16 GB RAM', 'Graphics: AMD Radeon RX 570 / NVIDIA GeForce GTX 1050 Ti', 'DirectX: Version 11', 'Storage: 40 GB available space']",07-Dec-23,['Owlcat Games'],['Owlcat Games'],Mostly Positive,-13539,11349,Grand Theft Auto V,Adventure,Review,2
Stolen Realm,"Stolen Realm is a simultaneous turn-based tactical dungeon crawling looter with action RPG elements where you control up to 6 heroes, solo or through online co-op, venturing forth in adventures set in a high-fantasy, low-poly world.","['Turn-Based Tactics', 'Party-Based RPG', 'Tactical RPG', 'CRPG', 'Turn-Based Strategy', 'RPG', 'Character Customization', 'Online Co-Op', 'Strategy', 'Turn-Based Combat', 'Multiplayer', 'Loot', 'Top-Down', 'Tactical', 'Local Co-Op', 'Adventure', 'Board Game', 'Class-Based', 'Tabletop', 'Singleplayer']","['OS *: Windows XP or newer', 'Processor: Dual Core from Intel or AMD at 2.8 GHz', 'Memory: 2 GB RAM', 'Graphics: Intel HD 3000']","['OS *: Windows XP or newer', 'Processor: Dual Core from Intel or AMD at 2.8 GHz', 'Memory: 2 GB RAM', 'Graphics: Intel HD 3000']",08-Mar-24,['Burst2Flame Entertainment'],['Burst2Flame Entertainment'],Very Positive,-2386,2008,The Witcher 3: Wild Hunt,Adventure,Review,3
Sins of a Solar Empire II,"Battle for galactic dominance in this real-time 4X strategy game with unrivaled scale! You’ll explore, expand, exploit, and exterminate through military force, diplomacy, trade, culture, influence, and other underhanded tactics.","['Strategy', 'Space', '4X', 'RTS', 'Sci-fi', 'Singleplayer', 'Multiplayer', 'Tactical', 'Story Rich', 'Co-op', 'PvE', 'PvP', 'Immersive Sim', 'Real-Time', '3D', 'Base Building', 'Tutorial', 'Competitive', 'Choices Matter', 'Isometric']","['Requires a 64-bit processor and operating system', 'OS: Windows 10 v1607+ / 11 (64-bit)', 'Processor: 4-core Processor (Intel Core i5 5th-generation or AMD Ryzen 2x00 series)', 'Memory: 8 GB RAM', 'Graphics: 3D Video Card w/2GB VRAM (Nvidia GeForce 950 / AMD Radeon RX 450)', 'DirectX: Version 11', 'Network: Broadband Internet connection', 'Storage: 20 GB available space', 'Additional Notes: 1920x1080 minimum screen resolution']","['Requires a 64-bit processor and operating system', 'OS: Windows 11', 'Processor: 8-core Processor (Intel Core i7 9th-generation or AMD Ryzen 3x00 series)', 'Memory: 16 GB RAM', 'Graphics: 3D Video Card w/4GB+ VRAM (Nvidia GeForce 1060 or AMD Radeon 580)', 'DirectX: Version 11', 'Network: Broadband Internet connection', 'Storage: 20 GB available space', 'Additional Notes: 1920x1080 minimum screen resolution']",15-Aug-24,"['Ironclad Games Corporation', 'Stardock Entertainment']",['Stardock Entertainment'],Very Positive,-3953,3365,Baldur's Gate 3,Adventure,Review,4
Summoners War,"A global hit RPG that captured the Summoners all around the world! Jump into the Sky Arena, a world under battle over the vital resource: Mana Crystals. Design your own deck and strategy using over 1,500 Monsters to claim victory. Go on an epic adventure with your Monsters!","['Free to Play', 'RPG', 'Strategy', 'RTS', 'Strategy RPG', 'Turn-Based Strategy', 'Tactical RPG', 'Turn-Based Tactics', 'PvP', 'Real Time Tactics', 'PvE', 'Tutorial', 'Turn-Based Combat', 'Lore-Rich', 'Fantasy', 'Colorful', 'Anime', 'Cinematic', 'Multiplayer', 'Party-Based RPG']","['Requires a 64-bit processor and operating system', 'OS: windows10 (64bit)', 'Processor: Intel Core i3', 'Memory: 4 GB RAM', 'Graphics: NVIDIA GTX 460 or higher', 'DirectX: Version 11', 'Storage: 10 GB available space', 'Sound Card: Onboard Audio or higher']","['Requires a 64-bit processor and operating system', 'OS: windows10 (64bit)', 'Processor: Intel Core i5', 'Memory: 8 GB RAM', 'Graphics: NVIDIA GTX 660 or higher', 'DirectX: Version 11', 'Storage: 10 GB available space', 'Sound Card: Onboard Audio or higher']",07-Jan-24,['Com2uS'],['Com2uS'],Mostly Positive,-6355,2395,Black Myth: Wukong,Adventure,Review,5
Frostpunk,"Frostpunk is the first society survival game. As the ruler of the last city on Earth, it is your duty to manage both its citizens and infrastructure. What decisions will you make to ensure your society's survival? What will you do when pushed to breaking point? Who will you become in the process?","['City Builder', 'Survival', 'Resource Management', 'Strategy', 'Post-apocalyptic', 'Steampunk', 'Colony Sim', 'Building', 'Base Building', 'Singleplayer', 'Simulation', 'Management', 'Choices Matter', 'Atmospheric', 'Economy', 'Dark', 'Difficult', 'RTS', 'Great Soundtrack', 'Real-Time with Pause']","['Requires a 64-bit processor and operating system', 'OS *: Windows 7/8/10 64-bit', 'Processor: 3.2 GHz Dual Core Processor', 'Memory: 4 GB RAM', 'Graphics: GeForce GTX 660, Radeon R7 370 or equivalent with 2 GB of video RAM', 'DirectX: Version 11', 'Storage: 8 GB available space', 'Sound Card: DirectX compatible', ""Additional Notes: Please make sure that you have the latest VC package installed, and - if you're using Windows 7 or 8 - that you have the KB4019990 update applied.""]","['Requires a 64-bit processor and operating system', 'OS *: Windows 7/8/10 64-bit', 'Processor: 3.2 GHz Quad Core Processor', 'Memory: 8 GB RAM', 'Graphics: GeForce 970, Radeon RX 580 or equivalent with 4GB of video RAM', 'DirectX: Version 11', 'Storage: 8 GB available space', 'Sound Card: DirectX compatible', ""Additional Notes: Please make sure that you have the latest VC package installed, and - if you're using Windows 7 or 8 - that you have the KB4019990 update applied.""]",24-Apr-18,['11 bit studios'],['11 bit studios'],Very Positive,-93041,40384,Rust,Adventure,Review,6
Age of Empires IV: Anniversary Edition,"Celebrating its first year of delighting millions of global players, the award-winning and best-selling strategy franchise continues with Age of Empires IV: Anniversary Edition, putting you at the center of even more epic historical battles that shaped the world.","['Strategy', 'RTS', 'Base Building', 'War', 'Multiplayer', 'Singleplayer', 'Medieval', 'Resource Management', 'City Builder', 'Historical', 'Action RTS', 'PvP', 'PvE', 'Co-op', '3D', 'Isometric', 'Management', 'Open World', 'Online Co-Op', 'Mature']","['Requires a 64-bit processor and operating system', 'OS: Windows 10 64bit | Windows 11 64bit', 'Processor: Intel Core i5-6300U or AMD Ryzen 5 2400G | CPU with AVX support required', 'Memory: 8 GB RAM', 'Graphics: Intel HD 520 or AMD Radeon RX Vega 11', 'DirectX: Version 12', 'Storage: 50 GB available space']","['Requires a 64-bit processor and operating system', 'OS: Windows 10 64bit | Windows 11 64bit', 'Processor: 3.6 GHz 6-core (Intel i5) or AMD Ryzen 5 1600 | CPU with AVX support required', 'Memory: 16 GB RAM', 'Graphics: Nvidia GeForce 970 GPU or AMD Radeon RX 570 GPU with 4GB of VRAM', 'DirectX: Version 12', 'Storage: 50 GB available space', 'Additional Notes: 4 GB of video RAM and 16 GB of system RAM']",28-Oct-21,"['Relic Entertainment', 'Forgotten Empires', 'Climax Studios', ""World's Edge""]",['Xbox Game Studios'],Very Positive,-53466,27543,The Forest,Adventure,Review,7
Europa Universalis IV,"Europa Universalis IV gives you control of a nation through four dramatic centuries. Rule your land and dominate the world with unparalleled freedom, depth and historical accuracy. Write a new history of the world and build an empire for the ages.","['Grand Strategy', 'Strategy', 'Historical', 'Simulation', '4X', 'Alternate History', 'Diplomacy', 'Military', 'Wargame', 'Economy', 'Replay Value', 'Sandbox', 'Political', 'Real-Time with Pause', 'Moddable', 'Nonlinear', 'Co-op', 'Management', 'Singleplayer', 'Multiplayer']","['OS: Windows® 10 Home 64 bit', 'Processor: Intel® Core™ i3-2105 / AMD® FX 4300', 'Memory: 4 GB RAM', 'Graphics: Nvidia® GeForce™ GTX 460 / AMD® Radeon™ HD 5850', 'Video Memory: 1 GB RAM', 'DirectX®:9.0c', 'Hard Drive:6 GB HD space', 'Sound:Direct X- compatible soundcard', 'Other Requirements:Broadband Internet connection', 'Additional:Controller support: 3-button mouse, keyboard and speakers. Internet Connection or LAN for multiplayer']","['OS: Windows® 10 Home 64 bit', 'Processor: Intel® Core™ i3 3240 / AMD® FX 8120', 'Memory: 8 GB RAM', 'Graphics: Nvidia® GeForce™ GTX 560 Ti', 'Video Memory: 1 GB RAM', 'DirectX®:9.0c', 'Hard Drive:6 GB HD space', 'Sound:Direct X-compatible soundcard', 'Other Requirements:Broadband Internet connection', 'Additional:Controller support: 3-button mouse, keyboard and speakers. Internet Connection or LAN for multiplayer']",13-Aug-13,"['Paradox Development Studio', 'Paradox Tinto']",['Paradox Interactive'],Very Positive,-86744,64805,Red Dead Redemption 2,Adventure,Review,8
Balatro,"The poker roguelike. Balatro is a hypnotically satisfying deckbuilder where you play illegal poker hands, discover game-changing jokers, and trigger adrenaline-pumping, outrageous combos.","['Roguelike Deckbuilder', 'Card Game', 'Roguelike', 'Deckbuilding', 'Singleplayer', 'Strategy', 'Card Battler', 'Turn-Based', 'Replay Value', 'Pixel Graphics', 'Choices Matter', 'Roguelite', 'Casual', 'Turn-Based Strategy', 'Difficult', '2D', 'Arcade', 'Simulation', 'Relaxing', 'Procedural Generation']","['Requires a 64-bit processor and operating system', 'OS *: Windows 7, 8, 10, 11 x64', 'Processor: Intel Core i3', 'Memory: 1 GB RAM', 'Graphics: OpenGL 2.1 compatible graphics card, integrated graphics', 'Storage: 150 MB available space']",['Requires a 64-bit processor and operating system'],20-Feb-24,['LocalThunk'],['Playstack'],Overwhelmingly Positive,-42900,32160,Lethal Company,Adventure,Review,9
Age of Empires II: Definitive Edition,"Age of Empires II: Definitive Edition features “The Last Khans” with 3 new campaigns and 4 new Civilizations. Frequent updates include events, additional content, new game modes, and enhanced features with the recent addition of Co-Op mode!","['Strategy', 'RTS', 'City Builder', 'Multiplayer', 'Base Building', 'Historical', 'Singleplayer', 'Medieval', 'Resource Management', 'Classic', 'Tactical', 'Real-Time', 'Co-op', 'Remake', 'Isometric', '2D', 'Replay Value', 'Action', 'Great Soundtrack', 'Adventure']","['OS: Windows 10 64bit', 'Processor: Intel Core 2 Duo or AMD Athlon 64x2 5600+', 'Memory: 4 GB RAM', 'Graphics: NVIDIA® GeForce® GT 420 or ATI™ Radeon™ HD 6850 or Intel® HD Graphics 4000 or better with 2 GB VRAM', 'DirectX: Version 11', 'Network: Broadband Internet connection', 'Storage: 15 GB available space', 'Additional Notes: 2GB of video memory + 4GB of system memory required']","['OS: Windows 10 64bit', 'Processor: 2.4 Ghz i5 or greater or AMD equivalent', 'Memory: 8 GB RAM', 'Graphics: Nvidia® GTX 650 or AMD HD 5850 or better', 'DirectX: Version 11', 'Network: Broadband Internet connection', 'Storage: 15 GB available space']",14-Nov-19,"['Forgotten Empires', 'Tantalus Media', 'Wicked Witch', ""World's Edge""]",['Xbox Game Studios'],Very Positive,-131277,57295,Hollow Knight,Adventure,Review,10
MARVEL SNAP,"MARVEL SNAP is a fast-paced Collectible Card Game that reimagines the genre with innovative mechanics. Winner of multiple awards like 'Best Strategy Game' and 'Breakthrough Game of the Year,' we invite you to join millions of players worldwide – Jump right in!","['Free to Play', 'Card Battler', 'Strategy', 'Card Game', 'Multiplayer', 'Turn-Based Tactics', 'PvP', 'Casual', 'Superhero', 'Deckbuilding', 'Comic Book', 'Stylized', 'Trading Card Game', 'Early Access', 'Co-op', 'Mouse only']","['OS *: Windows 7 (SP1+)', 'Processor: Intel Core i5-650 | AMD Phenom II X4 965', 'Memory: 4 GB RAM', 'Graphics: Nvidia GeForce GTX 650 / AMD Radeon HD HD 6950', 'DirectX: Version 10', 'Storage: 4 GB available space']","['OS: Windows 10', 'Processor: Intel Core i5-2300 | AMD FX-6300', 'Memory: 4 GB RAM', 'Graphics: Nvidia GeForce GTX 660 / AMD Radeon HD 7970', 'DirectX: Version 10', 'Storage: 4 GB available space']",22-Aug-23,"['Second Dinner Studios, Inc.']",['Nuverse'],Very Positive,-27412,15130,Unturned,Adventure,Review,11
Tactical Breach Wizards,"In Tactical Breach Wizards, you lead a team of renegade wizards in kevlar through turn-based battles to unravel a modern conspiracy plot. Combine their unique spells in clever ways, or rewind time to try every crazy plan you can think of to punch a Traffic Warlock through a 4th story window.","['Turn-Based Tactics', 'Puzzle', 'Story Rich', 'Turn-Based Strategy', 'Turn-Based', 'Funny', 'Singleplayer', 'Strategy RPG', 'Tactical', 'Tactical RPG', 'RPG', 'Adventure', 'Military', 'Indie', 'Mystery', 'Isometric', 'Comedy', 'Fantasy', 'Strategy', 'Satire']","['OS *: Windows 7', 'Processor: Intel Core 2 Duo E4700 2.6 GHz or AMD Phenom 9950 Quad Core 2.6 GHz', 'Memory: 8 GB RAM', 'Graphics: 1GB ATI Radeon HD 5770, 1GB NVIDIA GeForce GTX 460 or better', 'DirectX: Version 11', 'Storage: 3 GB available space']","['OS *: Windows 7', 'Processor: Intel Core 2 Duo E4700 2.6 GHz or AMD Phenom 9950 Quad Core 2.6 GHz', 'Memory: 8 GB RAM', 'Graphics: 1GB ATI Radeon HD 5770, 1GB NVIDIA GeForce GTX 460 or better', 'DirectX: Version 11', 'Storage: 3 GB available space']",22-Aug-24,['Suspicious Developments Inc'],['Suspicious Developments'],Overwhelmingly Positive,-4950,4766,Subnautica,Adventure,Review,12
Total War: MEDIEVAL II – Definitive Edition,"Spanning the most turbulent era in Western history, your quest for territory and power takes you through Europe, Africa, the Middle East, and even onto the shores of the New World.","['Strategy', 'Medieval', 'Historical', 'Turn-Based Strategy', 'Grand Strategy', 'War', 'RTS', 'Tactical', 'Singleplayer', 'Multiplayer', 'Moddable', 'Military', 'Turn-Based', 'Real Time Tactics', 'Classic', 'Simulation', 'Action', 'Sandbox', 'Great Soundtrack', '4X']","['Microsoft® Windows® 2000/XP', 'Celeron 1.5GHz Pentium 4® (1500MHz) or equivalent AMD® processor', '512MB RAM', '11GB of uncompressed free hard disk space', '100% DirectX® 9.0c compatible 16-bit sound cardand latest drivers', '100% Windows® 2000/XP compatible mouse,keyboard and latest drivers', 'DirectX® 9.0c', '128MB Hardware Accelerated video card with Shader 1 support and the latest drivers. Must be 100% DirectX® 9.0c compatible', '1024 x 768 minimum display resolution', 'Internet (TCP / IP) play supported; Internet play requires broadband connection and latest drivers; LAN play requires Network card.']","['Microsoft® Windows® 2000/XP', 'Celeron 1.5GHz Pentium 4® (1500MHz) or equivalent AMD® processor', '512MB RAM', '11GB of uncompressed free hard disk space', '100% DirectX® 9.0c compatible 16-bit sound cardand latest drivers', '100% Windows® 2000/XP compatible mouse,keyboard and latest drivers', 'DirectX® 9.0c', '128MB Hardware Accelerated video card with Shader 1 support and the latest drivers. Must be 100% DirectX® 9.0c compatible', '1024 x 768 minimum display resolution', 'Internet (TCP / IP) play supported; Internet play requires broadband connection and latest drivers; LAN play requires Network card.']",15-Nov-06,"['CREATIVE ASSEMBLY', 'Feral Interactive (Mac)', 'Feral Interactive (Linux)']","['SEGA', 'Feral Interactive (Mac)', 'Feral Interactive (Linux)']",Overwhelmingly Positive,-23553,19019,Cyberpunk 2077,Role-Playing,Sales,1
Sid Meier's Civilization® V,"Create, discover, and download new player-created maps, scenarios, interfaces, and more!","['Turn-Based Strategy', 'Strategy', 'Turn-Based', 'Multiplayer', 'Historical', '4X', 'Addictive', 'Singleplayer', 'Hex Grid', 'Grand Strategy', 'Replay Value', 'Co-op', 'Economy', 'Tactical', 'Diplomacy', 'Moddable', 'Simulation', 'Classic', 'Great Soundtrack', 'Touch-Friendly']","['OS *: Windows® Vista SP2/ Windows® 7', 'Processor: Intel Core 2 Duo 1.8 GHz or AMD Athlon X2 64 2.0 GHz', 'Memory: 2GB RAM', 'Graphics:256 MB ATI HD2600 XT or better, 256 MB nVidia 7900 GS or better, or Core i3 or better integrated graphics', 'DirectX®: DirectX® version 9.0c', 'Hard Drive: 8 GB Free', 'Sound: DirectX 9.0c-compatible sound card', 'Note: Optimized for the touch-screen Ultrabook™ device']","['OS *: Windows® Vista SP2/ Windows® 7', 'Processor: 1.8 GHz Quad Core CPU', 'Memory: 4 GB RAM', 'Graphics: 512 MB ATI 4800 series or better, 512 MB nVidia 9800 series or better', 'DirectX®: DirectX® version 11', 'Hard Drive: 8 GB Free', 'Sound: DirectX 9.0c-compatible sound card', 'Note: Optimized for the touch-screen Ultrabook™ device']",23-Sep-10,"['Firaxis Games', 'Aspyr (Mac)', 'Aspyr (Linux)']","['2K', 'Aspyr (Mac)', 'Aspyr (Linux)']",Overwhelmingly Positive,-121085,122805,Black Myth: Wukong,Role-Playing,Sales,2
Plants vs. Zombies GOTY Edition,"Zombies are invading your home, and the only defense is your arsenal of plants! Armed with an alien nursery-worth of zombie-zapping plants like peashooters and cherry bombs, you'll need to think fast and plant faster to stop dozens of types of zombies dead in their tracks.","['Tower Defense', 'Zombies', 'Strategy', 'Singleplayer', 'Casual', 'Classic', '2D', 'Comedy', 'Great Soundtrack', 'Family Friendly', 'Funny', 'Puzzle', 'Addictive', 'Cute', 'Survival', 'Indie', 'Tactical', 'Adventure', 'Touch-Friendly', 'Post-apocalyptic']","['OS *: Windows XP/Vista/7', 'Processor: 1.2GHz+ processor', 'Memory: 1GB of RAM', 'Graphics: 128MB of video memory, 16-bit or 32-bit color quality', 'DirectX: DirectX 8 or later', 'Hard Drive: 65+MB of free hard drive space', 'Sound: DirectX-compatible sound']","['OS *: Windows XP/Vista/7', 'Processor: 1.2GHz+ processor', 'Memory: 1GB of RAM', 'Graphics: 128MB of video memory, 16-bit or 32-bit color quality', 'DirectX: DirectX 8 or later', 'Hard Drive: 65+MB of free hard drive space', 'Sound: DirectX-compatible sound']",05-May-09,"['PopCap Games, Inc.']","['PopCap Games, Inc.', 'Electronic Arts']",Overwhelmingly Positive,-120413,38015,ELDEN RING,Role-Playing,Sales,3
Age of Empires II (Retired),"Age of Empires II has been re-imagined in high definition. With the release of Age of Empires II: Definitive Edition, this product will not be updated further.","['Strategy', 'RTS', 'Medieval', 'Multiplayer', 'Classic', 'Historical', 'Base Building', 'City Builder', 'Resource Management', 'Singleplayer', 'Tactical', 'Real-Time', 'Co-op', 'Competitive', 'Replay Value', 'Remake', '2D', 'Isometric', 'Action', 'Adventure']","['OS *:Windows Vista, 7, 8 Pro+', 'Processor:1.2GHZ CPU', 'Memory:1 GB RAM', 'Graphics:Direct X 9.0c Capable GPU', 'DirectX®:9.0c', 'Hard Drive:2 GB HD space']",['Additional:900x600 minimum display resolution'],09-Apr-13,"['Skybox Labs', 'Hidden Path Entertainment', 'Ensemble Studios', 'Forgotten Empires']",['Xbox Game Studios'],Overwhelmingly Positive,-82338,43872,Dota 2,Role-Playing,Sales,4
Ultimate General: Civil War,Ultimate General: Civil War is a tactical real time strategy war-game. Experience the bloodiest period of U.S. history - the American Civil War of 1861-1865.,"['Wargame', 'Real Time Tactics', 'War', 'America', 'Tabletop', 'RTS', 'Grand Strategy', 'Strategy', 'Historical', 'Board Game', 'Strategy RPG', 'Education', 'Turn-Based Strategy', 'Tactical', 'Military', 'Combat', 'Simulation', 'Singleplayer', 'Multiplayer', 'Indie']","['OS *: Windows 7 - 32 bit', 'Processor: Intel i3', 'Memory: 2 GB RAM', 'Graphics: 512Mb VRAM, Minimum 1366x768 resolution, Intel HD 4000 and higher, GeForce 8800 and higher, AMD Radeon X1600', 'DirectX: Version 9.0', 'Storage: 2 GB available space']","['OS: Windows 10 - 64 bits', 'Processor: Intel i5', 'Memory: 2 GB RAM', 'Graphics: 1GB VRAM, 1920x1080 resolution, Nvidia 960 or  Radeon R9 285', 'DirectX: Version 9.0', 'Storage: 2 GB available space']",14-Jul-17,['Game-Labs'],['Game-Labs'],Very Positive,-7428,5197,Crusader Kings III,Role-Playing,Sales,5
Dune: Imperium,The award-winning board game of strategy and intrigue in the iconic universe of Dune. The Spice must flow.,"['Board Game', 'Strategy', 'Deckbuilding', 'Sci-fi', 'Simulation', 'Card Game', 'Grand Strategy', 'Tabletop', 'Space Sim', 'Top-Down', 'Dystopian', 'Economy', 'Fantasy', 'Futuristic', 'Lore-Rich', 'Military', 'Political', 'Space', 'Choices Matter', 'Combat']","['Requires a 64-bit processor and operating system', 'OS: Windows 10 (64bit version only)', 'Processor: Intel Core i5-2400 or AMD Ryzen 3 2200G', 'Memory: 4 GB RAM', 'Graphics: Intel HD 2000 graphics or Vega 8 graphics', 'DirectX: Version 11', 'Storage: 2 GB available space']","['Requires a 64-bit processor and operating system', 'OS: Windows 10 or better (64bit version only)', 'Processor: NVIDIA GeForce 8800 GT (512 MB) or ATI Radeon HD 4850 (512 MB) or better', 'Memory: 8 GB RAM', 'Graphics: Graphics card with DX11 or OpenGL 3.x capabilities', 'DirectX: Version 11', 'Network: Broadband Internet connection', 'Storage: 5 GB available space']",13-Mar-24,['Dire Wolf'],['Dire Wolf'],Overwhelmingly Positive,-2104,1470,Cyberpunk 2077: Phantom Liberty,Role-Playing,Sales,6
STAR WARS™ Empire at War - Gold Pack,"Command or corrupt an entire galaxy in the definitive Star Wars strategy collection. It is a time of galactic civil war. Will you take up the reins of the Rebellion, assume control of the Empire, or rule the Star Wars Underworld?","['Strategy', 'RTS', 'Space', 'Sci-fi', 'Multiplayer', 'Singleplayer', 'Moddable', 'Mod', 'Tactical', 'War', 'Action', 'Classic', 'Great Soundtrack', 'Grand Strategy', 'Simulation', '4X', 'Co-op', 'Adventure', 'Atmospheric', 'Epic']","['Computer: 100% DirectX 9.0c compatible computer', 'Processor: Intel Pentium III 1.0GHz or AMD Athlon 1.0 GHz', 'OS *: Windows XP SP3, Windows Vista SP2, Windows 7', 'RAM: 512 MB', 'Graphics Card: 64 MB graphics card with Shader Model 2.0 support / ATI Radeon 9600 / NVIDIA 7200 / Intel 965', 'Sound Card: 100% DirectX 9.0c compatible PCI, USB, or Onboard Audio Device', 'Internet: 56kbps or faster connection (required for multiplayer only)']","['Computer: 100% DirectX 9.0c compatible computer', 'Processor: Intel Pentium Dual Core CPU', 'OS *: Windows XP SP3, Windows Vista SP2, Windows 7', 'RAM: 1 GB', 'Graphics Card: 256 MB graphics card with Shader Model 3.0 support / ATI Radeon X1900 / NVIDIA 8600', 'Sound Card: 100% DirectX 9.0c compatible PCI, USB, or Onboard Audio Device', 'Internet: 1.5Mb DSL/Cable connection (required for multiplayer only)']",16-Feb-06,['Petroglyph'],"['LucasArts', 'Lucasfilm', 'Disney']",Overwhelmingly Positive,-31032,26262,Once Human,Role-Playing,Sales,7
For The King,For The King is a strategic RPG that blends tabletop and roguelike elements in a challenging adventure that spans the realms. Set off on a single player experience or play cooperatively both online and locally.,"['RPG', 'Online Co-Op', 'Strategy', 'Open World', 'Roguelike', 'Turn-Based', 'Multiplayer', 'Co-op', 'Turn-Based Combat', 'Adventure', 'Tabletop', 'Roguelite', 'Turn-Based Strategy', 'Party-Based RPG', 'Board Game', 'Local Co-Op', 'Indie', 'Fantasy', 'Hex Grid', 'Strategy RPG']","['Requires a 64-bit processor and operating system', 'OS *: Windows 7 / 8 / 8.1 / 10 x64', 'Processor: Intel Core2 Duo E4300 (2 * 1800) / AMD Athlon Dual Core 4450e (2 * 2300) or equivalent', 'Memory: 4 GB RAM', 'Graphics: GeForce 8800 GTX (768 MB) / Intel HD 4600 / Radeon HD 3850 (512 MB)', 'DirectX: Version 9.0c', 'Storage: 3 GB available space']","['Requires a 64-bit processor and operating system', 'OS *: Windows 7 / 8 / 8.1 / 10 x64', 'Processor: Intel Core i5-4570T (2* 2900) / AMD FX-6100 (6 * 3300) or equivalent', 'Memory: 4 GB RAM', 'Graphics: GeForce GTX 750 Ti (2048 MB) / Radeon HD 7850  (2048 MB)', 'DirectX: Version 9.0c', 'Storage: 3 GB available space']",19-Apr-18,['IronOak Games'],['Curve Games'],Very Positive,-28178,15530,Persona 5 Royal,Role-Playing,Sales,8
