name,short_description,genres,minimum_system_requirement,recommend_system_requirement,release_date,developer,publisher,overall_player_rating,number_of_reviews_from_purchased_people,number_of_english_reviews,game_name,genre,rank_type,rank
Black Myth: Wukong,"Black Myth: Wukong is an action RPG rooted in Chinese mythology. You shall set out as the Destined One to venture into the challenges and marvels ahead, to uncover the obscured truth beneath the veil of a glorious legend from the past.","['Mythology', 'Action RPG', 'Action', 'RPG', 'Souls-like', 'Combat', 'Story Rich', 'Singleplayer', 'Drama', 'Action-Adventure', 'Dark Fantasy', 'Atmospheric', 'Adventure', '3D', 'Fantasy', 'Hack and Slash', 'Third Person', 'Difficult', 'Music', 'Violent']","['Requires a 64-bit processor and operating system', 'OS: Windows 10 64-bit', 'Processor: Intel Core i5-8400 / AMD Ryzen 5 1600', 'Memory: 16 GB RAM', 'Graphics: NVIDIA GeForce GTX 1060 6GB / AMD Radeon RX 580 8GB', 'DirectX: Version 11', 'Storage: 130 GB available space', 'Sound Card: Windows Compatible Audio Device', 'Additional Notes: HDD Supported, SSD Recommended. The above specifications were tested with DLSS/FSR/XeSS enabled.']","['Requires a 64-bit processor and operating system', 'OS: Windows 10 64-bit', 'Processor: Intel Core i7-9700 / AMD Ryzen 5 5500', 'Memory: 16 GB RAM', 'Graphics: NVIDIA GeForce RTX 2060 / AMD Radeon RX 5700 XT / INTEL Arc A750', 'DirectX: Version 12', 'Storage: 130 GB available space', 'Sound Card: Windows Compatible Audio Device', 'Additional Notes: SSD Required. The above specifications were tested with DLSS/FSR/XeSS enabled.']",19-Aug-24,['Game Science'],['Game Science'],Overwhelmingly Positive,-654820,51931,Counter-Strike 2,Action,Sales,1
Counter-Strike 2,"For over two decades, Counter-Strike has offered an elite competitive experience, one shaped by millions of players from across the globe. And now the next chapter in the CS story is about to begin. This is Counter-Strike 2.","['FPS', 'Shooter', 'Multiplayer', 'Competitive', 'Action', 'Team-Based', 'eSports', 'Tactical', 'First-Person', 'PvP', 'Online Co-Op', 'Co-op', 'Strategy', 'Military', 'War', 'Difficult', 'Trading', 'Realistic', 'Fast-Paced', 'Moddable']","['OS: Windows® 10', 'Processor: 4 hardware CPU threads - Intel® Core™ i5 750 or higher', 'Memory: 8 GB RAM', 'Graphics: Video card must be 1 GB or more and should be a DirectX 11-compatible with support for Shader Model 5.0', 'DirectX: Version 11', 'Storage: 85 GB available space']","['OS: Windows® 10', 'Processor: 4 hardware CPU threads - Intel® Core™ i5 750 or higher', 'Memory: 8 GB RAM', 'Graphics: Video card must be 1 GB or more and should be a DirectX 11-compatible with support for Shader Model 5.0', 'DirectX: Version 11', 'Storage: 85 GB available space']",21-Aug-12,['Valve'],['Valve'],Very Positive,-8313603,2258990,"Warhammer 40,000: Space Marine 2",Action,Sales,2
"Warhammer 40,000: Space Marine 2",Embody the superhuman skill and brutality of a Space Marine. Unleash deadly abilities and devastating weaponry to obliterate the relentless Tyranid swarms. Defend the Imperium in spectacular third-person action in solo or multiplayer modes.,"['Warhammer 40K', 'Action', 'Third-Person Shooter', 'Adventure', 'Multiplayer', 'Action-Adventure', 'PvE', 'Co-op', 'Third Person', 'Wargame', 'Sci-fi', '3D', 'Narration', 'Fantasy', 'Space', 'War', 'Realistic', 'Singleplayer', 'Cinematic', 'Futuristic']","['Requires a 64-bit processor and operating system', 'OS: Windows 10 (1903 min)/11 64-bit', 'Processor: AMD Ryzen 5 2600X / Intel Core i5-8600K', 'Memory: 8 GB RAM', 'Graphics: 6 GB VRAM, AMD Radeon RX 580 / Nvidia GeForce GTX 1060', 'DirectX: Version 12', 'Storage: 75 GB available space', 'Additional Notes: SSD required. 30 FPS in 1920x1080 with ""Low"" preset.']","['Requires a 64-bit processor and operating system', 'OS: Windows 10 (1903 min)/11 64-bit', 'Processor: AMD Ryzen 7 5800X / Intel Core i7-12700', 'Memory: 16 GB RAM', 'Graphics: 8 GB VRAM, AMD Radeon RX 6800 XT / Nvidia GeForce RTX 3070', 'DirectX: Version 12', 'Storage: 75 GB available space', 'Additional Notes: SSD required. 60 FPS in 1920x1080 with the ""Ultra"" preset.']",09-Sep-24,['Saber Interactive'],['Focus Entertainment'],Very Positive,50802,51920,Cyberpunk 2077,Action,Sales,3
Cyberpunk 2077,"Cyberpunk 2077 is an open-world, action-adventure RPG set in the dark future of Night City — a dangerous megalopolis obsessed with power, glamor, and ceaseless body modification.","['Cyberpunk', 'Open World', 'Nudity', 'RPG', 'Singleplayer', 'Sci-fi', 'Futuristic', 'FPS', 'Mature', 'Story Rich', 'First-Person', 'Atmospheric', 'Exploration', 'Action', 'Violent', 'Great Soundtrack', 'Action RPG', 'Adventure', 'Character Customization', 'Immersive Sim']","['Requires a 64-bit processor and operating system', 'OS: 64-bit Windows 10', 'Processor: Core i7-6700 or Ryzen 5 1600', 'Memory: 12 GB RAM', 'Graphics: GeForce GTX 1060 6GB or Radeon RX 580 8GB or Arc A380', 'DirectX: Version 12', 'Storage: 70 GB available space', 'Additional Notes: SSD required. Attention: In this game you will encounter a variety of visual effects that may provide seizures or loss of consciousness in a minority of people. If you or someone you know experiences any of the above symptoms while playing, stop and seek medical attention immediately.']","['Requires a 64-bit processor and operating system', 'OS: 64-bit Windows 10', 'Processor: Core i7-12700 or Ryzen 7 7800X3D', 'Memory: 16 GB RAM', 'Graphics: GeForce RTX 2060 SUPER or Radeon RX 5700 XT or Arc A770', 'DirectX: Version 12', 'Storage: 70 GB available space', 'Additional Notes: SSD required.']",10-Dec-20,['CD PROJEKT RED'],['CD PROJEKT RED'],Very Positive,-680264,324124,Black Myth: Wukong,Action,Sales,4
ELDEN RING,"THE CRITICALLY ACCLAIMED FANTASY ACTION RPG. Rise, Tarnished, and be guided by grace to brandish the power of the Elden Ring and become an Elden Lord in the Lands Between.","['Souls-like', 'Dark Fantasy', 'Open World', 'RPG', 'Difficult', 'Action RPG', 'Third Person', 'Multiplayer', 'Fantasy', 'Singleplayer', 'Online Co-Op', 'Action', 'Co-op', 'PvP', 'Atmospheric', 'Great Soundtrack', 'Violent', '3D', 'Character Customization', 'Family Friendly']","['Requires a 64-bit processor and operating system', 'OS: Windows 10', 'Processor: INTEL CORE I5-8400 or AMD RYZEN 3 3300X', 'Memory: 12 GB RAM', 'Graphics: NVIDIA GEFORCE GTX 1060 3 GB or AMD RADEON RX 580 4 GB', 'DirectX: Version 12', 'Storage: 60 GB available space', 'Sound Card: Windows Compatible Audio Device', 'Additional Notes:']","['Requires a 64-bit processor and operating system', 'OS: Windows 10/11', 'Processor: INTEL CORE I7-8700K or AMD RYZEN 5 3600X', 'Memory: 16 GB RAM', 'Graphics: NVIDIA GEFORCE GTX 1070 8 GB or AMD RADEON RX VEGA 56 8 GB', 'DirectX: Version 12', 'Storage: 60 GB available space', 'Sound Card: Windows Compatible Audio Device', 'Additional Notes:']",25-Feb-22,"['FromSoftware, Inc.']","['FromSoftware, Inc.', 'Bandai Namco Entertainment']",Very Positive,-705261,491741,ELDEN RING,Action,Sales,5
PUBG: BATTLEGROUNDS,"Play PUBG: BATTLEGROUNDS for free. Land on strategic locations, loot weapons and supplies, and survive to become the last team standing across various, diverse Battlegrounds. Squad up and join the Battlegrounds for the original Battle Royale experience that only PUBG: BATTLEGROUNDS can offer.","['Survival', 'Shooter', 'Battle Royale', 'Multiplayer', 'FPS', 'PvP', 'Third-Person Shooter', 'Action', 'Online Co-Op', 'Tactical', 'Co-op', 'First-Person', 'Strategy', 'Early Access', 'Competitive', 'Third Person', 'Team-Based', 'Difficult', 'Simulation', 'Stealth']","['Requires a 64-bit processor and operating system', 'OS: 64-bit Windows 10', 'Processor: Intel Core i5-4430 / AMD FX-6300', 'Memory: 8 GB RAM', 'Graphics: NVIDIA GeForce GTX 960 2GB / AMD Radeon R7 370 2GB', 'DirectX: Version 11', 'Network: Broadband Internet connection', 'Storage: 40 GB available space']","['Requires a 64-bit processor and operating system', 'OS: 64-bit Windows 10', 'Processor: Intel Core i5-6600K / AMD Ryzen 5 1600', 'Memory: 16 GB RAM', 'Graphics: NVIDIA GeForce GTX 1060 3GB / AMD Radeon RX 580 4GB', 'DirectX: Version 11', 'Network: Broadband Internet connection', 'Storage: 50 GB available space']",21-Dec-17,['PUBG Corporation'],"['KRAFTON, Inc.']",Mixed,-2432683,417109,PUBG: BATTLEGROUNDS,Action,Sales,6
Apex Legends™,"Apex Legends is the award-winning, free-to-play Hero Shooter from Respawn Entertainment. Master an ever-growing roster of legendary characters with powerful abilities, and experience strategic squad play and innovative gameplay in the next evolution of Hero Shooter and Battle Royale.","['Free to Play', 'Battle Royale', 'Multiplayer', 'FPS', 'Shooter', 'First-Person', 'PvP', 'Action', 'Hero Shooter', 'Team-Based', 'Tactical', 'Sci-fi', 'Survival', 'Loot', 'Character Customization', 'Funny', 'Co-op', 'Lore-Rich', 'Cyberpunk', 'Cinematic']","['Requires a 64-bit processor and operating system', 'OS: 64-bit Windows 10', 'Processor: AMD FX 4350 or Equivalent, Intel Core i3 6300 or Equivalent', 'Memory: 6 GB RAM', 'Graphics: AMD Radeon™ HD 7730, NVIDIA GeForce® GT 640', 'DirectX: Version 11', 'Network: Broadband Internet connection', 'Storage: 75 GB available space', 'Additional Notes: ~3.8GB for 1 localized language']","['Requires a 64-bit processor and operating system', 'OS: 64-bit Windows 10', 'Processor: Ryzen 5 CPU or Equivalent', 'Memory: 8 GB RAM', 'Graphics: AMD Radeon™ R9 290, NVIDIA GeForce® GTX 970', 'DirectX: Version 11', 'Network: Broadband Internet connection', 'Storage: 75 GB available space', 'Additional Notes: ~3.8GB for 1 localized language']",04-Nov-20,['Respawn'],['Electronic Arts'],Mixed,-948818,406269,DRAGON BALL: Sparking! ZERO,Action,Sales,7
Dota 2,"Every day, millions of players worldwide enter battle as one of over a hundred Dota heroes. And no matter if it's their 10th hour of play or 1,000th, there's always something new to discover. With regular updates that ensure a constant evolution of gameplay, features, and heroes, Dota 2 has taken on a life of its own.","['Free to Play', 'MOBA', 'Multiplayer', 'Strategy', 'eSports', 'Team-Based', 'Competitive', 'Action', 'Online Co-Op', 'PvP', 'Difficult', 'Co-op', 'RTS', 'RPG', 'Tower Defense', 'Fantasy', 'Character Customization', 'Replay Value', 'Action RPG', 'Simulation']","['OS *: Windows 7 or newer', 'Processor: Dual core from Intel or AMD at 2.8 GHz', 'Memory: 4 GB RAM', 'Graphics: NVIDIA GeForce 8600/9600GT, ATI/AMD Radeon HD2600/3600', 'DirectX: Version 11', 'Network: Broadband Internet connection', 'Storage: 60 GB available space', 'Sound Card: DirectX Compatible']","['OS *: Windows 7 or newer', 'Processor: Dual core from Intel or AMD at 2.8 GHz', 'Memory: 4 GB RAM', 'Graphics: NVIDIA GeForce 8600/9600GT, ATI/AMD Radeon HD2600/3600', 'DirectX: Version 11', 'Network: Broadband Internet connection', 'Storage: 60 GB available space', 'Sound Card: DirectX Compatible']",09-Jul-13,['Valve'],['Valve'],Very Positive,-2322723,731670,Apex Legends™,Action,Sales,8
Party Animals,"Fight your friends as puppies, kittens and other fuzzy creatures in PARTY ANIMALS! Paw it out with your friends remotely, or huddle together for chaotic fun on the same screen. Interact with the world under our realistic physics engine. Did I mention PUPPIES?","['Casual', 'Multiplayer', 'Funny', 'Cute', 'Party Game', 'Fighting', 'Action', 'PvP', 'Co-op', 'Party', 'Family Friendly', 'Online Co-Op', 'Local Multiplayer', 'Physics', '3D Fighter', '4 Player Local', 'Indie', 'Local Co-Op', 'Team-Based', 'Action-Adventure']","['Requires a 64-bit processor and operating system', 'OS: Windows 10, 64-bit / Windows 11, 64-bit', 'Processor: Intel Core i5 / AMD equivalent', 'Memory: 8 GB RAM', 'Graphics: NVIDIA GTX 750-Ti / AMD RX 550, 2GB VRam', 'DirectX: Version 11', 'Network: Broadband Internet connection', 'Storage: 8 GB available space']","['Requires a 64-bit processor and operating system', 'OS: Windows 10, 64-bit / Windows 11, 64-bit', 'Processor: Intel Core i5 7500K / AMD equivalent', 'Memory: 16 GB RAM', 'Graphics: NVIDIA GTX 1060 / AMD RX 580, 4GB VRam / Intel Arc A380', 'DirectX: Version 11', 'Network: Broadband Internet connection', 'Storage: 8 GB available space']",20-Sep-23,['Recreate Games'],['Source Technology'],Mostly Positive,-38225,16141,Dota 2,Action,Sales,9
Total War: WARHAMMER III,"The cataclysmic conclusion to the Total War: WARHAMMER trilogy is here. Rally your forces and step into the Realm of Chaos, a dimension of mind-bending horror where the very fate of the world will be decided. Will you conquer your Daemons… or command them?","['Strategy', 'Turn-Based Strategy', 'Grand Strategy', 'RTS', 'Fantasy', 'Real Time Tactics', 'War', 'Dark Fantasy', 'Action', 'Tactical', 'Atmospheric', 'Dwarf', 'Games Workshop', 'Multiplayer', 'Colorful', 'Co-op', 'PvP', 'Singleplayer', 'Story Rich', 'Online Co-Op']","['OS *: Windows 7 64-bit', 'Processor: Intel i3/Ryzen 3 series', 'Memory: 6 GB RAM', 'Graphics: Nvidia GTX 900/AMD RX 400 series | Intel Iris Xe Graphics', 'DirectX: Version 11', 'Storage: 120 GB available space', 'Additional Notes: This game may be updated over time and have paid for and free. additional content released for it. Please be aware that this may increase the minimum requirements for running the game above the specification stated here.']","['OS: Windows 10 64-bit', 'Processor: Intel i5/Ryzen 5 series', 'Memory: 8 GB RAM', 'Graphics: Nvidia GeForce GTX 1660 Ti/AMD RX 5600-XT/Intel Arc A750', 'DirectX: Version 11', 'Storage: 120 GB available space', 'Additional Notes: 8GB Memory if using integrated GPU.']",16-Feb-22,"['CREATIVE ASSEMBLY', 'Feral Interactive']","['SEGA', 'Feral Interactive']",Mixed,-75474,61292,Party Animals,Action,Sales,10
Cyberpunk 2077: Phantom Liberty,,"['RPG', 'Sexual Content', 'Cyberpunk', 'Open World', 'Story Rich', 'Nudity', 'Violent', 'Gore', 'Atmospheric', 'Singleplayer', 'First-Person', 'FPS', 'Character Customization', 'Action RPG', 'Action', 'Choices Matter', 'Shooter', 'Horror', 'Great Soundtrack', 'Stealth']","['Requires a 64-bit processor and operating system', 'OS: 64-bit Windows 10', 'Processor: Core i7-6700 or Ryzen 5 1600', 'Memory: 12 GB RAM', 'Graphics: GeForce GTX 1060 6GB or Radeon RX 580 8GB or Arc A380', 'DirectX: Version 12', 'Storage: 35 GB available space', 'Additional Notes: Attention: see upcoming change to the requirements. Storage: 35 GB SSD. In this game you will encounter a variety of visual effects that may provide seizures or loss of consciousness in a minority of people. If you or someone you know experiences any of the above symptoms while playing, stop and seek medical attention immediately.']","['Requires a 64-bit processor and operating system', 'OS: 64-bit Windows 10', 'Processor: Core i7-12700 or Ryzen 7 7800X3D', 'Memory: 16 GB RAM', 'Graphics: GeForce RTX 2060 SUPER or Radeon RX 5700 XT or Arc A770', 'DirectX: Version 12', 'Storage: 35 GB available space', 'Additional Notes: Storage: 35 GB SSD']",26-Sep-23,['CD PROJEKT RED'],['CD PROJEKT RED'],Very Positive,-15726,7969,Total War: WARHAMMER III,Action,Sales,11
Once Human,"Once Human is a multiplayer open-world survival game set in a strange, post-apocalyptic future. Unite with friends to fight monstrous enemies, uncover secret plots, compete for resources, and build your own territory. Once, you were merely human. Now, you have the power to remake the world.","['Survival', 'Open World', 'Multiplayer', 'Free to Play', 'Co-op', 'Shooter', 'Horror', 'Post-apocalyptic', 'Base Building', 'Action', 'Adventure', 'Strategy', '3D', 'RPG', 'Simulation', 'MMORPG', 'Action-Adventure', 'PvP', 'Singleplayer', 'Strategy RPG']","['OS: Windows 10 64-bit Operating System', 'Processor: Intel Core i5-4460', 'Memory: 8 GB RAM', 'Graphics: Nvidia GTX 750ti 4G / AMD Radeon RX550', 'DirectX: Version 11', 'Network: Broadband Internet connection', 'Storage: 55 GB available space', 'Additional Notes: SSD is highly recommended']","['OS: Windows 10 64-bit Operating System', 'Processor: Intel Core i7-7700', 'Memory: 16 GB RAM', 'Graphics: Nvidia GTX 1060 6G / AMD Radeon RX 580 2304SP / Intel ARC A380', 'DirectX: Version 11', 'Network: Broadband Internet connection', 'Storage: 55 GB available space', 'Additional Notes: SSD is highly recommended']",09-Jul-24,['Starry Studio'],['Starry Studio'],Mostly Positive,-89006,44785,Cyberpunk 2077: Phantom Liberty,Action,Sales,12
NARAKA: BLADEPOINT,"Dive into the legends of the Far East in NARAKA: BLADEPOINT; team up with friends in fast-paced melee fights for a Battle Royale experience unlike any other. Find your playstyle with a varied cast of heroes with unique skills. More than 20 million players have already joined the fray, play free now!","['Battle Royale', 'Multiplayer', 'Martial Arts', 'PvP', 'Action', 'Female Protagonist', 'Character Customization', 'Massively Multiplayer', 'Fighting', 'Survival', 'Third Person', 'Swordplay', 'Hack and Slash', 'Anime', 'Parkour', 'Adventure', 'Mature', 'Free to Play', 'Violent', 'Gore']","['OS *: Windows 7 64-bit or newer', 'Processor: Intel i5 4th generation or AMD FX 6300 or equivalent', 'Memory: 8 GB RAM', 'Graphics: NVIDIA GeForce GTX 750TI, Intel Arc A380, AMD HD 6950 or equivalent', 'DirectX: Version 11', 'Network: Broadband Internet connection', 'Storage: 50 GB available space', 'Additional Notes: a) Can run at 720p/60fps; b) We advise you install the game on an SSD for a more streamlined experience. c) Requires “Windows Memory integrity and VBS enablement” to be disabled']","['OS: Windows 10 64-bit', 'Processor: Intel i7 7th generation or equivalent', 'Memory: 16 GB RAM', 'Graphics: NVIDIA GeForce GTX 1060 6G, Intel Arc A750, AMD RX480 or equivalent', 'DirectX: Version 11', 'Network: Broadband Internet connection', 'Storage: 50 GB available space', 'Additional Notes: a) Can run at 1080p/60fps; b) We advise you install the game on an SSD for a more streamlined experience. c) Requires “Windows Memory integrity and VBS enablement” to be disabled']",11-Aug-21,['24 Entertainment'],['NetEase Games Global'],Mostly Positive,-253231,20468,Once Human,Action,Sales,13
Warframe,Awaken as an unstoppable warrior and battle alongside your friends in this story-driven free-to-play online action game,"['Free to Play', 'Action RPG', 'Looter Shooter', 'Third-Person Shooter', 'Action', 'RPG', 'Third Person', 'Character Customization', 'Massively Multiplayer', 'Online Co-Op', 'Co-op', 'Singleplayer', 'PvE', 'Sci-fi', 'Space', 'Lore-Rich', 'Shooter', 'Hack and Slash', 'Parkour', 'Ninja']","['OS *:Windows 7 64-Bit (32-bit not supported)', 'Processor:Intel Core i7 860, Intel Core i5 750, or AMD FX-4100 (SSE 4.2 support required)', 'Video:DirectX 11+ capable Graphics Card', 'Memory:4 GB RAM', 'Storage:50 GB available HD space', 'Internet:Broadband Internet Connection Required']","['OS *:Windows 7 64-Bit (32-bit not supported)', 'Processor:Intel Core i7 860, Intel Core i5 750, or AMD FX-4100 (SSE 4.2 support required)', 'Video:DirectX 11+ capable Graphics Card', 'Memory:4 GB RAM', 'Storage:50 GB available HD space', 'Internet:Broadband Internet Connection Required']",25-Mar-13,['Digital Extremes'],['Digital Extremes'],Very Positive,-591568,253397,NARAKA: BLADEPOINT,Action,Sales,14
Grounded,"The world is a vast, beautiful and dangerous place – especially when you have been shrunk to the size of an ant. Can you thrive alongside the hordes of giant insects, fighting to survive the perils of the backyard?","['Survival', 'Multiplayer', 'Co-op', 'Open World Survival Craft', 'Base Building', 'Crafting', 'Adventure', 'Open World', 'Horror', 'Online Co-Op', 'Exploration', 'Action', 'Sandbox', 'First-Person', 'Singleplayer', 'RPG', 'Third Person', 'Cute', 'Early Access', 'Funny']","['Requires a 64-bit processor and operating system', 'OS: Windows 10 64bit', 'Processor: Intel Core i3-3225', 'Memory: 4 GB RAM', 'Graphics: Nvidia GTX 650 Ti', 'Storage: 8 GB available space']","['Requires a 64-bit processor and operating system', 'OS: Windows 11 64bit', 'Processor: Intel Core i7-7700K or Ryzen 5 1600', 'Memory: 8 GB RAM', 'Graphics: GeForce GTX 1060 6GB or Radeon RX 470', 'Storage: 8 GB available space']",27-Sep-22,['Obsidian Entertainment'],['Xbox Game Studios'],Very Positive,-58988,41223,Warframe,Action,Sales,15
Tom Clancy's Rainbow Six® Siege,"Tom Clancy's Rainbow Six® Siege is an elite, tactical team-based shooter where superior planning and execution triumph.","['FPS', 'PvP', 'eSports', 'Multiplayer', 'Shooter', 'Tactical', 'Competitive', 'Online Co-Op', 'Action', 'Hero Shooter', 'Team-Based', 'Military', 'Strategy', 'First-Person', 'War', 'Co-op', 'Realistic', 'Destruction', 'Difficult', '3D']","['OS *: Originally released for Windows 7, the game can be played on Windows 10 and Windows 11 OS', 'Processor: Intel Core i3 560 @ 3.3 GHz or AMD Phenom II X4 945 @ 3.0 GHz', 'Memory: 6 GB RAM', 'Graphics: NVIDIA GeForce GTX 460 or AMD Radeon HD 5870 (DirectX-11 compliant with 1GB of VRAM)', 'Network: Broadband Internet connection', 'Storage: 61 GB available space', 'Sound Card: DirectX® 9.0c compatible sound card with latest drivers', 'Additional Notes: SUPPORTED VIDEO CARDS AT TIME OF RELEASE:  GeForce GTX 460 or better, GTX 560 or better, GTX 650 or better, GTX 750 or better, or any card from the GT900 and Titan Series, Radeon HD5870 or better, HD6870 or better, HD7770 or better, R7 260X or better, or any card from the R-300 series and Fury X. Laptop models of these cards may work but are not supported. These chipsets are the only ones that will run this game. Additional chipsets may be supported after release. For an up-to-date list of supported chipsets, please visit the FAQ for this game on our support website: http://support.ubi.com. Game contains FairFight (https://www.gameblocks.com/products) and BattleEye (https://www.battleye.com/) anti-cheat technology.']","['OS *: Originally released for Windows 7, the game can be played on Windows 10 and Windows 11 OS', 'Processor: Intel Core i5-2500K @ 3.3 GHz or better or AMD FX-8120 @ 3.1 Ghz or better', 'Memory: 8 GB RAM', 'Graphics: NVIDIA GeForce GTX 670 (or GTX 760 / GTX 960) or AMD Radeon HD 7970 (or R9 280x [2GB VRAM] / R9 380 / Fury X)', 'Network: Broadband Internet connection', 'Storage: 61 GB available space', 'Sound Card: DirectX® 9.0c compatible sound card 5.1 with latest drivers', 'Additional Notes: SUPPORTED VIDEO CARDS AT TIME OF RELEASE:  GeForce GTX 460 or better, GTX 560 or better, GTX 650 or better, GTX 750 or better, or any card from the GT900 and Titan Series, Radeon HD5870 or better, HD6870 or better, HD7770 or better, R7 260X or better, or any card from the R-300 series and Fury X. Laptop models of these cards may work but are not supported. These chipsets are the only ones that will run this game. Additional chipsets may be supported after release. For an up-to-date list of supported chipsets, please visit the FAQ for this game on our support website: http://support.ubi.com. Game contains FairFight (https://www.gameblocks.com/products) and BattleEye (https://www.battleye.com/) anti-cheat technology.']",01-Dec-15,['Ubisoft Montreal'],['Ubisoft'],Very Positive,-1121920,646088,Grounded,Action,Sales,16
Grand Theft Auto V,"Grand Theft Auto V for PC offers players the option to explore the award-winning world of Los Santos and Blaine County in resolutions of up to 4k and beyond, as well as the chance to experience the game running at 60 frames per second.","['Open World', 'Action', 'Multiplayer', 'Crime', 'Automobile Sim', 'Third Person', 'First-Person', 'Mature', 'Shooter', 'Adventure', 'Singleplayer', 'Third-Person Shooter', 'Racing', 'Co-op', 'Sandbox', 'Atmospheric', 'Funny', 'Great Soundtrack', 'Comedy', 'Moddable']","['Requires a 64-bit processor and operating system', 'OS: Windows 10 64 Bit', 'Processor: Intel Core 2 Quad CPU Q6600 @ 2.40GHz (4 CPUs) / AMD Phenom 9850 Quad-Core Processor (4 CPUs) @ 2.5GHz', 'Memory: 4 GB RAM', 'Graphics: NVIDIA 9800 GT 1GB / AMD HD 4870 1GB (DX 10, 10.1, 11)', 'Storage: 120 GB available space', 'Sound Card: 100% DirectX 10 compatible', 'Additional Notes: Over time downloadable content and programming changes will change the system requirements for this game.  Please refer to your hardware manufacturer and www.rockstargames.com/support for current compatibility information. Some system components such as mobile chipsets, integrated, and AGP graphics cards may be incompatible. Unlisted specifications may not be supported by publisher.     Other requirements:  Installation and online play requires log-in to Rockstar Games Social Club (13+) network; internet connection required for activation, online play, and periodic entitlement verification; software installations required including Rockstar Games Social Club platform, DirectX , Chromium, and Microsoft Visual C++ 2008 sp1 Redistributable Package, and authentication software that recognizes certain hardware attributes for entitlement, digital rights management, system, and other support purposes.     SINGLE USE SERIAL CODE REGISTRATION VIA INTERNET REQUIRED; REGISTRATION IS LIMITED TO ONE ROCKSTAR GAMES SOCIAL CLUB ACCOUNT (13+) PER SERIAL CODE; ONLY ONE PC LOG-IN ALLOWED PER SOCIAL CLUB ACCOUNT AT ANY TIME; SERIAL CODE(S) ARE NON-TRANSFERABLE ONCE USED; SOCIAL CLUB ACCOUNTS ARE NON-TRANSFERABLE.  Partner Requirements:  Please check the terms of service of this site before purchasing this software.']","['Requires a 64-bit processor and operating system', 'OS: Windows 10 64 Bit', 'Processor: Intel Core i5 3470 @ 3.2GHz (4 CPUs) / AMD X8 FX-8350 @ 4GHz (8 CPUs)', 'Memory: 8 GB RAM', 'Graphics: NVIDIA GTX 660 2GB / AMD HD 7870 2GB', 'Storage: 120 GB available space', 'Sound Card: 100% DirectX 10 compatible']",14-Apr-15,['Rockstar North'],['Rockstar Games'],Very Positive,-1714757,591334,Grand Theft Auto V,Action,Sales,17
